{
  "$schema": "https://json-schema.org/draft/2020-12/schema",
  "type": "object",
  "required": ["mappingId", "version", "sourceComponents", "mappings"],
  "properties": {
    "mappingId": { "type": "string" },
    "version": { "type": "string" },
    "sourceComponents": { "type": "array", "items": { "type": "string" } },
    "mappings": { "type": "array" }
  },
  "additionalProperties": true
}
