{
  "mappingId": "tabula-desktop-mapping-v1",
  "version": "1.0.0",
  "sourceComponents": ["canvas-surface", "composer-bar", "terminal-drawer", "mode-chipbar"],
  "mappings": [
    {
      "componentId": "canvas-surface",
      "platform": "desktop",
      "primitive": "react section"
    },
    {
      "componentId": "composer-bar",
      "platform": "desktop",
      "primitive": "react form"
    },
    {
      "componentId": "terminal-drawer",
      "platform": "desktop",
      "primitive": "xterm.js panel"
    },
    {
      "componentId": "mode-chipbar",
      "platform": "desktop",
      "primitive": "chip/select toolbar"
    }
  ]
}
